[
  {
    "proposal_id": "prop-source-001",
    "lane": "source.variant",
    "objective": "Trace sibling call sites of the changed ownership transition.",
    "information_gain": 0.9,
    "impact_potential": 0.8,
    "reachability": 0.8,
    "novelty": 0.7,
    "exploration_bonus": 0.5,
    "cost": 0.4,
    "operational_risk": 0.1,
    "difficulty": 0.5,
    "repetition_count": 0,
    "target": "/root/cachorro-solana/engine",
    "action": "source.read",
    "side_effect": "workspace_write",
    "stopping_condition": "All sibling sites are classified with provenance.",
    "required_capabilities": ["context.compile"]
  },
  {
    "proposal_id": "prop-runtime-001",
    "lane": "runtime.state",
    "objective": "Measure whether the candidate state is reachable under a clean replay.",
    "information_gain": 0.8,
    "impact_potential": 0.8,
    "reachability": 0.6,
    "novelty": 0.9,
    "exploration_bonus": 0.9,
    "cost": 0.7,
    "operational_risk": 0.2,
    "difficulty": 0.7,
    "repetition_count": 0,
    "target": "https://api.example.test/v1/object",
    "action": "api.sequence",
    "side_effect": "network_read",
    "stopping_condition": "The target line is reached or the path constraint is identified.",
    "required_capabilities": ["evidence.refute"]
  },
  {
    "proposal_id": "prop-repeat-001",
    "lane": "source.variant",
    "objective": "Repeat the unchanged source query against the same graph revision.",
    "information_gain": 0.9,
    "impact_potential": 0.8,
    "reachability": 0.8,
    "novelty": 0.7,
    "exploration_bonus": 0.5,
    "cost": 0.4,
    "operational_risk": 0.1,
    "difficulty": 0.5,
    "repetition_count": 3,
    "target": "/root/cachorro-solana/engine",
    "action": "source.read",
    "side_effect": "workspace_write",
    "stopping_condition": "The repeated query produces a distinct graph delta.",
    "required_capabilities": ["context.compile"]
  }
]
